{
  "versao": 2,
  "id": "00000000000000000000000070",
  "versao_id": "00000000000000000000000020",
  "ancora": {
    "versao_id": "00000000000000000000000020",
    "bloco_id": "00000000000000000000000001",
    "inicio_utf16": 3,
    "fim_utf16": 5,
    "citacao": "🧭",
    "prefixo": "Um ",
    "sufixo": ", café e ﬁ."
  },
  "mensagens": [
    {
      "id": "00000000000000000000000071",
      "autor": "leitor",
      "texto": "Por que a bússola aqui?",
      "criada_em": "2026-09-23T12:00:00Z"
    },
    {
      "id": "00000000000000000000000072",
      "autor": "ia",
      "texto": "A bússola orienta a frase inteira.",
      "citacoes": [
        {
          "versao_id": "00000000000000000000000020",
          "bloco_id": "00000000000000000000000001",
          "inicio_utf16": 7,
          "fim_utf16": 12,
          "citacao": "café",
          "prefixo": "Um 🧭, ",
          "sufixo": " e ﬁ."
        }
      ],
      "contexto": {
        "snapshot_hash": "0000000000000000000000000000000000000000000000000000000000000000",
        "blocos": [
          "00000000000000000000000001"
        ]
      },
      "execucao": {
        "modelo": "executor-falso",
        "esforco": "medio"
      },
      "criada_em": "2026-09-23T11:00:00Z"
    }
  ],
  "estado": "aberta",
  "criada_em": "2026-09-23T12:00:00Z"
}
