{
  "versao": 2,
  "id": "00000000000000000000000070",
  "versao_id": "00000000000000000000000020",
  "ancora": {
    "versao_id": "00000000000000000000000020",
    "bloco_id": "00000000000000000000000001",
    "inicio_utf16": 3,
    "fim_utf16": 5,
    "citacao": "🧭",
    "prefixo": "Um ",
    "sufixo": ", café e ﬁ."
  },
  "mensagens": [],
  "estado": "aberta",
  "criada_em": "2026-09-23T12:00:00Z"
}
